{
  "$schema": "https://json-schema.org/draft/2020-12/schema",
  "$id": "https://raw.githubusercontent.com/zhinees/energieprijzen-nl/main/schema/leveranciers.schema.json",
  "title": "data/leveranciers.json",
  "type": "object",
  "required": [
    "versie",
    "gegenereerdOp",
    "valuta",
    "leveranciers"
  ],
  "properties": {
    "$schema": {
      "type": "string"
    },
    "versie": {
      "const": 1
    },
    "gegenereerdOp": {
      "type": "string"
    },
    "valuta": {
      "const": "EUR"
    },
    "leveranciers": {
      "type": "array",
      "items": {
        "type": "object",
        "required": [
          "id",
          "naam",
          "website",
          "tariefUrl",
          "producten",
          "kenmerken",
          "tarieven",
          "laatstUitgevoerd"
        ],
        "properties": {
          "id": {
            "type": "string"
          },
          "naam": {
            "type": "string"
          },
          "website": {
            "type": "string"
          },
          "tariefUrl": {
            "type": "string"
          },
          "producten": {
            "type": "object"
          },
          "kenmerken": {
            "type": "object"
          },
          "laatstUitgevoerd": {
            "type": "string"
          },
          "ophaalfout": {
            "type": "string"
          },
          "tarieven": {
            "type": "object",
            "additionalProperties": false,
            "properties": {
              "stroomVastPerMaand": {
                "$ref": "#/$defs/tariefwaarde"
              },
              "stroomInkoopopslag": {
                "$ref": "#/$defs/tariefwaarde"
              },
              "gasVastPerMaand": {
                "$ref": "#/$defs/tariefwaarde"
              },
              "gasInkoopopslag": {
                "$ref": "#/$defs/tariefwaarde"
              },
              "terugleverCorrectie": {
                "$ref": "#/$defs/tariefwaarde"
              }
            }
          },
          "eerder": {
            "type": "object",
            "additionalProperties": false,
            "description": "Tarieven van vóór de huidige, per veld, oudste eerst; elk geldt tot (niet t/m) 'tot'.",
            "properties": {
              "stroomVastPerMaand": {
                "type": "array",
                "items": {
                  "type": "object",
                  "required": [
                    "tot",
                    "bedragInclBtw",
                    "bedragExclBtw",
                    "bronUrl"
                  ],
                  "properties": {
                    "tot": {
                      "type": "string"
                    },
                    "bedragInclBtw": {
                      "type": "number"
                    },
                    "bedragExclBtw": {
                      "type": "number"
                    },
                    "bronUrl": {
                      "type": "string"
                    },
                    "notitie": {
                      "type": "string"
                    }
                  }
                }
              },
              "stroomInkoopopslag": {
                "type": "array",
                "items": {
                  "type": "object",
                  "required": [
                    "tot",
                    "bedragInclBtw",
                    "bedragExclBtw",
                    "bronUrl"
                  ],
                  "properties": {
                    "tot": {
                      "type": "string"
                    },
                    "bedragInclBtw": {
                      "type": "number"
                    },
                    "bedragExclBtw": {
                      "type": "number"
                    },
                    "bronUrl": {
                      "type": "string"
                    },
                    "notitie": {
                      "type": "string"
                    }
                  }
                }
              },
              "gasVastPerMaand": {
                "type": "array",
                "items": {
                  "type": "object",
                  "required": [
                    "tot",
                    "bedragInclBtw",
                    "bedragExclBtw",
                    "bronUrl"
                  ],
                  "properties": {
                    "tot": {
                      "type": "string"
                    },
                    "bedragInclBtw": {
                      "type": "number"
                    },
                    "bedragExclBtw": {
                      "type": "number"
                    },
                    "bronUrl": {
                      "type": "string"
                    },
                    "notitie": {
                      "type": "string"
                    }
                  }
                }
              },
              "gasInkoopopslag": {
                "type": "array",
                "items": {
                  "type": "object",
                  "required": [
                    "tot",
                    "bedragInclBtw",
                    "bedragExclBtw",
                    "bronUrl"
                  ],
                  "properties": {
                    "tot": {
                      "type": "string"
                    },
                    "bedragInclBtw": {
                      "type": "number"
                    },
                    "bedragExclBtw": {
                      "type": "number"
                    },
                    "bronUrl": {
                      "type": "string"
                    },
                    "notitie": {
                      "type": "string"
                    }
                  }
                }
              },
              "terugleverCorrectie": {
                "type": "array",
                "items": {
                  "type": "object",
                  "required": [
                    "tot",
                    "bedragInclBtw",
                    "bedragExclBtw",
                    "bronUrl"
                  ],
                  "properties": {
                    "tot": {
                      "type": "string"
                    },
                    "bedragInclBtw": {
                      "type": "number"
                    },
                    "bedragExclBtw": {
                      "type": "number"
                    },
                    "bronUrl": {
                      "type": "string"
                    },
                    "notitie": {
                      "type": "string"
                    }
                  }
                }
              }
            }
          }
        }
      }
    }
  },
  "$defs": {
    "tariefwaarde": {
      "type": "object",
      "required": [
        "bedragInclBtw",
        "bedragExclBtw",
        "eenheid",
        "bron",
        "geverifieerd",
        "sinds",
        "bronUrl"
      ],
      "properties": {
        "bedragInclBtw": {
          "type": [
            "number",
            "null"
          ],
          "description": "Wat een consument betaalt, inclusief 21% btw (het eigen bedrag van de leverancier als die het publiceert). null = onbekend of er btw over gaat."
        },
        "bedragExclBtw": {
          "type": [
            "number",
            "null"
          ],
          "description": "Exclusief btw"
        },
        "eenheid": {
          "enum": [
            "EUR/maand",
            "EUR/kWh",
            "EUR/m3"
          ]
        },
        "bron": {
          "enum": [
            "website",
            "rekentool",
            "handmatig"
          ]
        },
        "geverifieerd": {
          "type": "boolean"
        },
        "sinds": {
          "type": [
            "string",
            "null"
          ]
        },
        "laatstGecontroleerd": {
          "type": "string"
        },
        "bronUrl": {
          "type": [
            "string",
            "null"
          ]
        },
        "laatsteFout": {
          "type": "string"
        }
      }
    }
  }
}
